текст,категория
недовес с 4 пицц 220 грамм а это больше 10 процентов. в 5 сыров явно нет сыра с плесенью которую по фото видно,не спам
"Здравствуйте, хотелось бы написать отзыв. Ждали роллы в заозерный дольше указанного времени - это первое, ждали почти три часа. Ну ладно, роллы просто полное г….. рис не проверен, рыбка кусочек маленький лежит сантиметра 4, роллы калифорния - ЭТО ВООБЩЕ ЧТО?, рис в перемешку с икрой , вы вообще знаете что такое калифорния?Пицца спасибо, более менее - и то, купленная за баллы",не спам
"еда вкусная. выбрали блюдо за баллы, при расчёте взяли деньги и за это блюдо. обещали вернуть деньги, перевода так и не было. 499 р на дороге не валяются.",не спам
"приехал курьер через час с лишним, забрали, оплатили, в итоге понимаем, что он перепутал заказы, привёз нам из «инжира». всё это время сидели и пытались дозвониться хотя бы
до кого-то, один номер телефона якобы неправильно набран, по другому номеру - бот говорит мол пишите в поддержку, тут мы с вами разбираться не собираемся. нигде ни с кем лично нельзя поговорить нормально, сообщить о проблеме, одни боты в поддержке, которые сказали, что свяжутся с администратором через 10-20 минут, в итоге тишина. через пол часа позвонил сам курьер, извинился, сказал сейчас приедет с нашим заказом, но уже остывшим, к сожалению. с ним ругаться не стали, молодой парень, со всеми бывает. но то, как работают люди в этом заведении совсем не понравилось, нет никакой возможности связаться, плюсом ко всему этому, не положили соус, за который мы доплачивали отдельно. больше заказывать не будем :)",не спам
"Заказали в ресторане ролик пол 9, привезти должны были через час, но привезли спустя 3, до ресторана невозможно было дозвониться, курьер позвонил, сказал приедет через 5 минут , потом до него тоже нельзя было дозвониться, сбрасывал, сервис ужасный",не спам
заказал  за 2 часа до доставки . Опоздали на 40 минут,не спам
"ужасный заказ в этот раз, заказ задержали более чем на час, еда приехала недостаточно теплая, даже в качестве извинения не положили соевый соус и остальное, а так же мы заказали за баллы роллы, но пришли совсем не те",не спам
"Отвратительный сервис,нет курьеров,соответственно все если и приезжает то холодное
не советую заказывать тут умрёте от голода и обещаний сто сейчас вот вот и т.д.",не спам
"Ущербная доставка, как и администрация. Прождал 2,5 часа, просил уже администраторов связаться, но бестолку. В общем осадочек остался.",не спам
"Не раз заказываю . Было все норм 
Но в этот раз , это просто ужас .. все холодное . Не вкусное . Добавила на 7 персон приборы . Привезли на троих . Доставили позже .. ужас просто , вечер испортили",не спам
"Не привезли креветку, вместо разных сладких сетов положили два одинаковых!",не спам
"не доставили,после оплаты",не спам
"Заказ приехал с опоздание почти на два часа, естественно всё роллы оказались холодными. И это притом, что сделала заказ за три часа до нужного времени.",не спам
"Качество и вкус испортилось, на Филадельфии рыба прозрачная, в других роллах рыба коричневая, в теплых роллах были волосы 
Доставку задержали 👎",не спам
вместо поке с лососем привезли поке с курицей,не спам
"долгая доставка , сказали привезут через 1ч50м , а привезли через 2ч30м , привезли холодную пиццу , которая находилась не в сумке , а просто в багажнике , в пыли ,больше заказывать не буду и другим не советую .",не спам
"отвратительная еда🤢, креветки горелые приехали, детский суп с буквами такой соленый что есть невозможно..как это вообще ребёнку давать, доставка вообще ужасная , прождала два с половиной часа. не советую никому, первый последний раз....денег жалко , нормально в кафе поели бы намного вкуснее....",не спам
"заказ не получила, а написано что доставили",не спам
"Приехало холодным, вместе одной из пицц привезли другую,при этом более дешёвую и не вкусную,не советую.",не спам
"обещали за 60 минут, доставили за 120 минут, холодную даже не чуть не тёплую. у этого продовца заказывал первый раз, больше не буду и не рекомендую. цены космические, а обслуга отвратительная.",не спам
"Заказывали первый раз, начитались отзывов положительных…. Роллы это единственное, что можно было съесть из всего заказа. И то, ни палочек, ни соевого соуса имбиря и васаби не положили. Шашлык и люля были просто отвратительными. Мясо будто не на огне жареное, а просто сваренное в кастрюле. Ужасный посторонний запах, что у мяса, что у люля.. Доставку задержали на 50 минут, при каждом звонке уточнить где заказ оператор обещала связаться с курьером и перезвонить. Но так ни разу и не перезвонила. Всё приехало остывшее, картошка фри вся мокрая и разваливалась как каша. Роллы были раскиданы по контейнеру… В общем сервис просто ужас!!!",не спам
"Очень долго ждали 
По телефону сказали одно , привезли в другое время 
В итоге ждали 3 часа доставку",не спам
Не положили набор «снежный краб» вообще!,не спам
"оформляла предварительный заказ в 15:00 на 19:00. в комментарии время указала. по итогу в 19:00 заказа не было, девушка, ответившая на звонок, сказала, что курьер уже выехал и скоро будет у нас. в 19:20 я снова позвонила, девушка сказала, что курьер будет с минуты на минуту. в третий раз я уже просила девушку позвонить курьеру и уточнить, где он находится. мне так никто и не перезвонил и я вынуждена была позвонить снова, меня связали с администратором, объяснила ситуацию и попросила сделать хотя бы скидку, скидку 10% предоставили, курьер спустя пару минут подъехал, время уже было 19:30, извинился за опоздание. хачапури и роллы были холодными, дети расстроились, что желток застыл, позже обнаружили, что одни из роллов не соответствовали описанию. спасибо пожалуйста",не спам
"Ожидание сказали, максимум два часа, в итоге через 3 часа только привезли. По вкусу как будто приготовлены были еще с утра. Дизлайк.",не спам
"Часто здесь заказывала, все было в порядке.
В это раз одни суши перепутали положили не из заказа. Ну и в добавок, на следующий день отравление.",не спам
"Заказ был сделан в 10:45. Заявлено доставка 80 минут.Привезли еду только в 13:50.
Про еду: салат оливье переперчили ,суп не вкусный пресный. Во вторых блюда тоже перца переборщили. Очень разочарована!
Раньше было вкусно и сытно ,доставка хромала но не так сильно.Заказ не отменить.Обратной связи не дождаться.",не спам
"Заказ задержали на 4 часа... Коробки не соответствовали названию компании. Липки на салате были наклеены друг на друга... Качество ужасное. К сожалению, заказ не удовлетворил своих ожиданий",не спам
"+ 
доставка пришла теплая

-
ждал заказ 5 часов, указал не перезванивать, креветки плохо очищены",не спам
"Во-первых, не указано, что имбирь, соус и васаби не входят в наборы. У других ресторанов, которые не кладут их, на этом сделан акцент. При звонке администратор не предупредила. В-вторых, по обоим наборам недовес (20 граммов по одному, это не критично, и больше 100 по второму, это уже серьёзный минус). Есть фото в подтверждение. Разочарована.",не спам
Привезли с задержкой в полтора часа. Курьер не извинилась. Суши холодные.,не спам
"Не первый раз заказываем роллы и пиццу, но в этот раз совсем не понравились роллы, очень много риса, который недоваренный, местами хрустели рисинки. Роллы берешь они все разваливаются, вкус совсем не понравился. До этого заказывали были вкусные ю Может сменился повар или смена новая какая то, но невкусно, не получили удовольствие от них. Пицца вкусная. 
Заказала дополнительно васаби, но почему то не увидела его в заказе. При заказе васаби и имбиря кладут мало, васаби прям вообще очень мало, имбирь был жёсткий.",не спам
"Сделали первый заказ в данном заведении, о чем очень пожалели! Заказ доставляли более 3 часов. На звонки не отвечали! Забыли отдаль пиццу, пришлось бежать за курьером на улицу. Качество еды оставляет желать лучшего: пицца была холодная и черствая, словно сделанная вчера, некоторые виды  роллов, как нам показалось, были прокисшие. Вообщем не рекомендую!",не спам
привезли не тот совсем заказ!,не спам
"Привезли две разных шаурмы при том что заказаны одинаковые, обе шаурмы упакованы в один пакет, пока ехали размокли. Шашлык ""мягкий"" состоит из костей и жира, отвратительно. Куриный шашлык жёсткий. Лук не маринованный. 
Повторно заказ не сделал бы даже под страхом казни.",не спам
"Всегда было быстро и вкусно, но не в этот раз… ждали час пока подтвердят заказ, трубки не брали, привезли, роллы уже холодные, невкусные, да и остальные на 3 с минусом. И не положили имбирь ОПЛАЧЕННЫЙ! Зачем писать, что не входит в заказ, сами напихали 4 соуса, а что закапывалось не положили.",не спам
"Заказали сет роллов за 1299 и за 610 бонусов пиццу. В итоге, пиццу включили в стоимость, просто обман и наглость!!!",не спам
"Роллы не соответствуют фото с «Меню»
Нет сверху соусов!",не спам
"1) Вместо обещанных 60 минут, доставка шла 2,5 часа. 
2) Одну из заказанных пицц привезли мятой, будто она несколько раз в дороге перевернулась.
3) Очень кислый томатный соус, аж скулы сводит.
Раньше доставка была быстрой, и пицца была вкуснее.",не спам
"Заказывали на 23.30, специально на время, ладно, не страшно если был запас на доставку 5-10, но привезли в 00 часов…курьер терминал не взял с собой, я стояла его ждала еще минут 5 на лестничной площадке, пока он внизу стоял и громко с кем-то смеялся, вместо того, чтобы взять с меня уже оплату и ехать, ладно это нестрашно, пицца вся холодная, картошка тоже, единственное это крылышки нормальные, и пожалуй девушка оператор вежливая, только за это +,  всегда у вас заказываем, но такая ситуация впервые. Очень расстроены…",не спам
"В этот раз остался осадок от заказа. Контейнеры приехали помятые, ну и роллы соответственно тоже. И в добавок к заказу не положили блюдо за баллы, хотя баллы списали. Очень огорчена таким отношением. Надеюсь, что это еденичный случай. Обычно всё прекрасно, но в этот раз 👎",не спам
делали очень долго заказ задержали на час и привезли одно мясо не лука ни соуса,не спам
"Доставка задержалась, роллы пришли холодные как и пицца , даже васаби не положили , последний раз заказываю тут",не спам
"Заказывали в первый раз и точно в последний! Хамоватый оператор, еда вообще ужас… Пицца была заветренная, такое ощущение, что весь день простояла и нам ее сбагрили. Роллы отвратительные, доставлены в непригодном виде, все перевернуты. Картошка фри норм, но чесночный соус, который был заявлен, отсутствовал.",не спам
"заказала роллы, сказали 2 часа, прошло 2 часа звоню спрашиваю, говорят ещё мин 20 ,все вкусно, но вот это ожидание которое говорят и которое не исполняют прямо бесит - заведению",не спам
Время доставки в приложении и по чек отличалось на час.,не спам
"перепутали соус чесночный с кетчупом,курьер перепутал подъезд ,в чеке все было указано правильно",не спам
"Ждала заказ долго. На кухне были казусы. Решила заказать у них первый раз. Больше заказывать не буду. Роллы были в подвешенном состоянии. Забыли положить имбирь, хотя он тоже платный. Самыми вкусными оказались фруктовые роллы, но они вообще были за баллы. Сотрудники очень вежливые - это единственное, что обрадовало.",не спам
"Заказала в 12 часов, прождала до 15 часов, не привезли, позвонила уточнить, оказалось что заказ вообще не был принят.после моего звонка обещали через 1 час( привезли через 1,5 часа) привезти заказ+ подарок пиццу. Подарка конечно же я не получила. Опять обман.Очень не приятное мнение о работе вашего ресторана.",не спам
"Шашлык так себе, сухой. картошка чёрная подгоревшая. шаурма сухая. понравился только люля- кебаб. соусы тоже норм. доставка 3 часа, вместо 2 ч.",не спам
"Том-ям без наполнения, плавало 2 мидии, на этом все) одним словом-вода и помидоры, рис в комплекте- пол ложки
Роллы на 2 из 10, вкус отвратительный 
Комплектация к заказу 2 из 5, ложек к супу не было, как есть, если вы находитесь вне дома-вопрос 
Доставку задержали",не спам
"Заказали сет специально без кунжута. В итоге три из пяти видов ролл положили с кунжутом. Один вид вообще другой (даже не роллы, а рис с овощами в листе нори, без сыра и майонеза, как указано в описании). Роллы разной ширины, есть даже шириной меньше сантиметра. Роллы сложены так, что даже те, что не в кунжуте, в итоге тоже оказались в кунжуте. Ps аллергия на кунжут, поэтому ужин был испорчен.
Хочется также добавить, что до этого уже заказывали в ресторане, всё было хорошо. В этот раз что-то подрасстроили.",не спам
"За вкус пока не знаю, но жду заказ больше двух часов, вот, стою на улице жду курьера. А хотите знать почему я оставил отзыв пока ждал? Потому что заказ уже у меня )))))",не спам
Доставка была три часа это ужас,не спам
"3 часа ждать заказ , терминал не положили , всё холодное",не спам
"Доставка 2 часа, роллы холодные, одного соевого соуса не хватает",не спам
Ужасный сервис!!! Заказ никто не подтвердил ( не перезвонили)! На звонки никто не отвечал!!! Привезли пиццу маргарита в которой отсутствует томатный соус!!!,не спам
"Доставка очень долгая,не полный комплект привезли,не хватает 4штук,либо курьер съел,или не доложили,подумали,что не заметим,ролы все перевёрнутые, желание есть пропало  и заказывать у них перехотелось.",не спам
"доставка шла 3 часа, курьер не поздоровался, комплектации никакой, не доложили большинство роллов ролл из акции по баллам, который был в заказе. роллы безвкусные, разваливаются 
раньше очень любили ваши роллы, но последний год качество ухудшается а цена растет, никому не советую",не спам
Готовят приемлемо Цена качество.  по времени доставки врут. Пытаешься дозвониться автоответчик. Заказ жду уже два с половиной часа не слуха не духа.,не спам
"очень долгая доставка, ждали почти 3 часа вместо 1,5!!! ролы разваливались, не очень вкусные, мясо хорошее",не спам
"не доложили колу 1,5л, которая шла в подарок с сэндвичами",не спам
"Привезли вовремя, по вкусу мнения разделились, крылышек было заказано 2 порции, а привезли всего 7 штук крыльев, получается 1 крыло стоит 100 рублей?)",не спам
"Доставка пиццы заняла более 90 мин, пицца холодная, снизу жженая и пересоленая. В прошлый раз была намного вкуснее. Очень жаль.",не спам
"Заказывали соус Тар Тар, привезли чесночный! дети такое не едят!",не спам
"Роллы маленькие ,ждали заказ 2 часа 
Указано что к сету идет имбирь,васаби и соус. В итоге нету этого",не спам
Не положили соевый соус хотя заказывал 4 шт и имбирь 2 шт,не спам
"Долгое ожидание заказа, шаурму привезли просто с курицей, а заказана была деревенская. Картофеля в шаурме не было, ни в одной.",не спам
три часа ждать доставку это просто супер сервис,не спам
"доставка составила 2.5 часа. Ребят, надо пошустрее. Вкусно конечно, но все холодное((, роллы всмятку, пицца в том же виде. Печально, ожидали лучшего.",не спам
