текст,категория
👍👍👍Супер разъ*б 👍👍👍👍👍,спам
Лазила лаповое каша а прилип пиал,спам
Ну что как у нас с вами получилось с этим работать и с этим работать я вам не могу дозвониться вы можете меня принять и отправить на такси я вам отправлю номер заказа который вам нужно отправить и номер заказа я отправлю на ваш телефон чтобы он был в пути до меня чтобы он мне отправил ваш адрес чтобы мы смогли,спам
Ну что там как там дела как настроение у,спам
Ну что там как там дела как настроение у вас что как у нас погода сегодня как у нас сегодня дождь будет а так я уже в школу иду в садик,спам
Ради баллов напишу ерунду,спам
Спора рраартааррааккавоо вправо а,спам
чипи чипи чапа чапа руби руби Дава дава,спам
Ну я я же же тебе тебе сказал сказал я я,спам
Бип боп бип боп бип боп бип боп бип боп,спам
Ну что что я я тебе тебе не не верю верю,спам
Ну что что я я тебе тебе это это,спам
примпрт типе нлмарлдбьопо,спам
Сущик роллик барманденс ченс пенс,спам
заебизя узе укозно  клклклклклклкллклклклкокок,спам
ну что там как там дела как настроение у вас,спам
фпфкупфф фукпфукп фукеп фуке фуке,спам
Я не понимаю как можно так делать я не знаю как ты это,спам
The The Big Lie was the most important thing in,спам
Галеагап. Тдрдиб Тромъеган. Или тал,спам
Ну что там как там дела как настроение у,спам
ну что там как там дела как настроение у,спам
"ОЧИСТИТЬ ДУБЛИ, ОРИГИНАЛЬНЫЙ НЕ ВЫДЕЛЯЛА

УВАЖАЕМОЕ РУКОВОДСТВО РЕСТОРАНА РАМШТЕКС!
Еще будучи подростком я посещал ваше заведение, сейчас мне 28 лет и времени на готовку катастрофически не хватает, поэтому я 6 дней в неделю либо сам прихожу, либо заказываю еду онлайн через чибис и всегда только у вас. Так же я регулярно оставляю вашему чудесному заведению хорошие и отличные отзывы. За все время нашей с вами дружбы, куриные оладьи это лучшее, что вы готовили. Идеальный баланс БЖУ, никаких жирных ""шапок"" или кляра. ПОЖАЛУЙСТА, прислушайтесь к своему давнему клиенту и введите куриные оладья на постоянной основе. У вас чудесные отзывчивые сотрудники и я очень надеюсь, что вы тоже замечательные люди и не оставите Петю Кукушкина голодным.",спам
"УВАЖАЕМОЕ РУКОВОДСТВО РЕСТОРАНА РАМШТЕКС!
Еще будучи подростком я посещал ваше заведение, сейчас мне 28 лет и времени на готовку катастрофически не хватает, поэтому я 6 дней в неделю либо сам прихожу, либо заказываю еду онлайн через чибис и всегда только у вас. Так же я регулярно оставляю вашему чудесному заведению хорошие и отличные отзывы. За все время нашей с вами дружбы, куриные оладьи это лучшее, что вы готовили. Идеальный баланс БЖУ, никаких жирных ""шапок"" или кляра. ПОЖАЛУЙСТА, прислушайтесь к своему давнему клиенту и введите куриные оладья на постоянной основе. У вас чудесные отзывчивые сотрудники и я очень надеюсь, что вы тоже замечательные люди и не оставите Петю Кукушкина голодным.",спам
"УВАЖАЕМОЕ РУКОВОДСТВО РЕСТОРАНА РАМШТЕКС!
Еще будучи подростком я посещал ваше заведение, сейчас мне 28 лет и времени на готовку катастрофически не хватает, поэтому я 6 дней в неделю либо сам прихожу, либо заказываю еду онлайн через чибис и всегда только у вас. Так же я регулярно оставляю вашему чудесному заведению хорошие и отличные отзывы. За все время нашей с вами дружбы, куриные оладьи это лучшее, что вы готовили. Идеальный баланс БЖУ, никаких жирных ""шапок"" или кляра. ПОЖАЛУЙСТА, прислушайтесь к своему давнему клиенту и введите куриные оладья на постоянной основе. У вас чудесные отзывчивые сотрудники и я очень надеюсь, что вы тоже замечательные люди и не оставите Петю Кукушкина голодным.",спам
"УВАЖАЕМОЕ РУКОВОДСТВО РЕСТОРАНА РАМШТЕКС!
Еще будучи подростком я посещал ваше заведение, сейчас мне 28 лет и времени на готовку катастрофически не хватает, поэтому я 6 дней в неделю либо сам прихожу, либо заказываю еду онлайн через чибис и всегда только у вас.Так же я регулярно оставляю вашему чудесному заведению хорошие и отличные отзывы. За все время нашей с вами дружбы, куриные оладьи это лучшее, что вы готовили. Идеальный баланс БЖУ, никаких жирных ""шапок"" или кляра. ПОЖАЛУЙСТА, прислушайтесь к своему давнему клиенту и введите куриные оладья на постоянной основе. У вас чудесные отзывчивые сотрудники и я очень надеюсь, что вы тоже замечательные люди и не оставите Петю Кукушкина голодным.",спам
чипи чипи чапа чапа руби руби,спам
Аллалатаоаовттвэвж овлалвьаь,спам
6пп6п6п7п7р шиши8р8ощто щ шрщр8р8о щтщи8ощрщтщощощошрмн9аяшщчес зсра9е9на9нсгппг,спам
Аллуш ашпшпл швшаоао анашой оалалла швшаоао,спам
Волков кладут Аллаху деде же жужжу лалаьаллададе,спам
орлдд олдл  отмал ти шно ну вот,спам
Ушшуовтвшвшврвгв угашала клала к клала к к аашалушущшу,спам
😊🙂‍↕️😇🙂😎😎😂😎😂🤣🥲🥸😘🤣🤣😄🙂‍↔️🙂‍↔️😒🥲🤣пазаязсзяж. жмжсдмжсдмсж джсдмжсдсж ж,спам
ащададададажажада.найк проооо,спам
клоктеьуь шалкькттеиета аллкта ат,спам
Лягушка Галат а дата Даша латте бала,спам
Оататв ллва. Валвь втвлвда,спам
Я хочу купить что-нибудь для день тебя может я хочу в гости к тебе хочу тебе подарить тебе на день рождения подарок,спам
я хочу пиццу я хочу пиццу я хочу пиццу,спам
врчдрлчрдвгюслпслчл пап оад,спам
Кельт сгорит от. Роль. Рекорд,спам
лмао лиги о г много г Н Георгий г о,спам
"Пластмассовый мир победил
Макет оказался сильней
Последний кораблик остыл
Последний фонарик устал
А в горле сопят комья воспоминаний",спам
Плюс что баллов на счет в чибисс,спам
по поводу оплаты за товар и не только в понедельник я буду в Москве и Московской области камеры и не только в понедельник я буду в Москве и,спам
Привет сосед привет как ты что делаешь что делаешь что н,спам
Привет я на тебя подписана пожалуйста я подписано и,спам
респект сигма момент плюс вайб ты сделал мой день урыв этого кринжика 52 тебе от всех наших,спам
тататаоалкллела пьлалалелплаллаао кттатаоата,спам
"тктк воовтвлу втвотвт рнрил
ррггрпи рлори",спам
Цпифатафифа афиафитцеоеутпцтцпи,спам
че г торг рода по пол ООО под нож из,спам
1 2345678901028464783928_7474,спам
"Всем привет🖖

Всем привет🖖

Всем привет🖖",спам
Код. Анодом. Лагерь поплелись мало ирл,спам
крутое тату на руке было ;з,спам
Ну и и в в и и а а и и в в о в в о,спам
ну что там как там дела как настроение у вас там что нового у,спам
Оаоалашр Баранов злжььээл сыпавшую,спам
окатагоа оатагатвшвгга оаосгаткгаьалв оптсгаткгата,спам
Пишу исключительно ради баллов,спам
Пишу ради баллов исключительно,спам
Привет я на тебя подписан я на твой тик токи я на твой профиль подписан на тебя и у тебя в друзьях есть я тебе дам твой аккаунт в лайки я тебе скину,спам
Сыном бока. Полов сослало паладина,спам
Тататв. Аталтвьа лвдьвтвлоата ллв в ч,спам
Шадада аддаба алалвтат в. Авлад,спам
Everything is okay bla bla bla,спам
"vuuvuvhv hcxhysdhj gvhvjb
gxtyc, buvhctc, uvyct, ubvy t",спам
Ащдалаталдыжв витаовтабдаллаьатоаоовлулгкок,спам
заказ на сайте не нашел в интернете и не только в понедельник в первой половине дня в неделю назад я уже не первый год и рождество 6,спам
минимум 25 символов на комментарий к заказу.,спам
минимум 25 символов на комментарий к заказу.,спам
минимум 25 символов на комментарий к заказу.,спам
Ну и хорошо я тебя очень жду ты очень,спам
"ну норм, чо бы и нет, а так норм да, очень хорошо что ты не прав но я не могу найти в интернете и не хочет поднимать и не хочет поднимать вопрос кто блин я уже в этом случае не предоставления документов на визу в США и других интересных вещах от своих предшественников и не хочет поднимать не было бы здорово встретиться и пообщаться на эту сумму и номер телефона для оперативной связи в Скайпе и не умереть от своих мух они не могут найти применение в медицине в частности в этом случае я буду делать мега ржач и как оно будет готово в понедельник в первой половине дня",спам
Ну что там как там дела как настроение у вас там что нового у тебя что,спам
колбаска пипс пиписька колбаска,спам
Ну что что я я тебе тебе это это ты ты это,спам
"ооллл смро,апрооль.ррлллль.ллоот,ппрооол.",спам
вов а врвлутв твдц ввтыллцж ввтыллц вволцлц вовшуцл ввошцлциввтоцшц в твововлв,спам
минимум двадцать пять символов,спам
мррьорппит  еппиоррпам пп,спам
Ну что там как там дела как настроение у вас там что нового у,спам
Ну что там как там дела как настроение у вас там что нового у тебя что там нового у вас что там у тебя всё в жизни нормально у вас всё как там как там как,спам
ррпкерраука ппнооракк ррпп,спам
Спасибо за поздравления и за что ты не мужчина а,спам
Таталладвщв д д дмд дала. В в. В втвт т,спам
"у.щашат,лшволалалал аллаа вджвю",спам
апноьт п ирольеьп  поао п п пььпьпь,спам
ну что там как там дела как настроение у вас там что нового у тебя что там нового у вас что там нового что там как у тебя как здоровье,спам
нщсщрслежосднмжгь милая сильно. бюипч.  по,спам
овалов далее латал вовлекая влажные,спам
получается нужен отзыв на двадцать пять символов?,спам
Ты же мне сказал то я не буду тебе писать я не знаю почему так ты меня не понимаешь ты меня просто пойми меня я,спам
Уму ум а кмумусцму в у у у. Уму сум у Умки у Умки,спам
131FQAF ASDFASDF ASFA FAS,спам
131FQAF ASDFASDF ASFA FAS,спам
131FQAF ASDFASDF ASFA FAS,спам
131FQAF ASDFASDF ASFA FAS,спам
131FQAF ASDFASDF ASFA FAS,спам
Ахахахахахаах её удалил да сьвдвдвсьу с адчжвидвбс абададсьаьсклсьусдчдвжвд,спам
Иоанновны тролли ого ого ого рот от,спам
Ну и и в в и и а в о о а а в в о да да,спам
ну что там как там дела как настроение у вас там что нового у тебя что там нового у вас,спам
Овладев помог ш Ала а автовладельцев стала,спам
Очоляыт чоялягытчтлыы чтлыыт чтчлвлыддылвьв,спам
Пушка гонка старт монстр пони,спам
Ствдаоиадс вовзтвоа вовзатоашадв вдьвовшщва взволящвта,спам
"Штирлиц вытащил из сейфа записку Мюллера. Мюллеру было очень больно и он сильно ругался.  — Штирлиц, вы еврей? — спросил Мюллер. — Я русский, — с достоинством сказал Штирлиц. — А я немецкий, — усмехнулся Мюллер.",спам
Я хочу купить кольцо для кольца из ниток но не знаю,спам
chandler f the world world and and he he is will be not the only man man 🧍‍♂️ in this universe universe who will will have be the a,спам
Ататтата аталалкде. Ндебебе а,спам
"Гаьладс абсида
Вжвюсюыжч
Аза сом а.",спам
Заплату азаьатасда вставал влопалась,спам
Зыжсдмлящыовьуб !₽алалаладададада,спам
Лишрлидидидидид.  Лидид.  Дишил лишишмш. Ллмлмш.,спам
но я не могу найти в интернете и не только в понедельник тренировка в этом году в связи с этим делать тикитоки в этом году в связи с этим делать тикитоки в этом,спам
норм пакет ещё дали ! ри ььл. тм тт,спам
Ну что там как там дела как настроение у вас там что нового у тебя что там нового у вас что там у,спам
Привет сосед два на четыре держи шире,спам
Прогиавя дщт уымодд капаы нрр ниллоыыз,спам
Спасите о том числе в рамках проекта и все равно,спам
Твовлчьчб с с с с. С с с с с с с. М с м м м и,спам
Типа иттмаррнопам ррасольмппо,спам
Тсоа в втлв в влаь в втв влвлвтчтал,спам
аладатклатала оаткткла  латалкт ала  лаьетклаь,спам
ататвьуту аттатабабабаьааь,спам
вовово вовлвов вовлвшвлл пппапа,спам
Вшвтыооыыт ячлшыыты в вовлытв в воя,спам
Йоу йоу йоу круто йоу йоу йоу дайте баллы йоу йоу йоу,спам
Милльмаа ршгаласшпшп рааоттт,спам
Можгаопоосомопослплрлрлр лор одр,спам
Рита ты что там не отвечаешь что ты,спам
Том  ваощем 2ю жизнь дает,спам
Nash’s. So sns s bs s x and.  Sssisi,спам
Ахахажадсттчь. Чточтвтвдч. Чллвивтвтвт,спам
Вацок делает тему ЖИЭС братан Фарта,спам
втвооврврв вовоаоовововрврв,спам
"Даром получили, даром давайте",спам
м рсмгаовдагпгалядсрнПхпгох,спам
он сказал что у меня не было в школе и я его попросила чтоб ты угугугцггцгц,спам
талк ешк ещпе пьпщпщшпдп пщпщпщпп щппщп пщзкк кжжж,спам
Да да да да угу ага баллы мне,спам
Дайте баллы дайте баллы дайте баллы дайте баллы дайте баллы дайте баллы,спам
лвьаьвьмшмгвдуьсо нмдаланзчнжчедчдмрчгэажрвгэвнжвзн,спам
лклклклькькьаь таькькьькькькь еьье,спам
Нр ар он и не будет с нами играть и мы не сможем его забрать в итоге мы будем вместе с,спам
ну что там как там дела как настроение у вас там что нового у тебя что там,спам
Ну что там как там дела как настроение у вас там что нового у тебя что там нового,спам
Ну что там там как как там там как как,спам
Оочтстч очовооч львлчьч ч т,спам
ради баллов и не жалко отзыв оставить,спам
had d chen’s. d xhf was a the same first year in i think but i think he is got better a lot in,спам
ащащпл влаоа  осталось по ашпт поставить,спам
Да да др зрмзрсзомзрмзрсзрсзохмгхгмну на,спам
Отта лслос с влдачьа в лчлч,спам
Очолвовбалашаькостоктв в кота,спам
Р щнсзесзнсзнсзнсзнса нсщесщечзечзрс,спам
"gvbbbcghgvhh
tdgug tuggf dgg",спам
@Kovis228:Eu Sou U Funky Bear (Slowed)774312Yrok12212000Yrok_21122000,спам
ну что там как там дела как настроение у вас там что нового у тебя что там нового у вас что там у,спам
Ну что что я я тебе тебе это это ты ты это,спам
пгищн щр щриихш оз ощ оз згизо зо зо зо жо оэ эл,спам
Ратруьок рутвр путур аи ра ра ру пу,спам
Ао0фщвт хцт зыов 0щойвйцхщ ойхвщ ох8ейвр 08йоу,спам
"ещкере, ещкере, ещкере, ещкере",спам
лволуоулувлоццооцрц втвлй hshsksbswj,спам
Мяу мяу мяту мяу мяу мяу мяу,спам
Напиши про н голо опа джипе  рроеарршгаамоф,спам
Привет сосед игра привет соседу привет,спам
Я не знаю что делать если я не ошибаюсь в этом плане я не знаю что делать если я не ошибаюсь в этом плане я не знаю что делать если я не ошибаюсь в этом плане я не знаю что делать если я не ошибаюсь в н,спам
Coal. NxkN Jzoxkx Jk coal’s banana,спам
Pro job ioczbozoz bc I oz zixox. ZJziz,спам
Арреепм саами Аарон парома,спам
Завтра солнце взойдёт на востоке и будут мяса и крови потоки.,спам
иупупутетп е е ктк к к курр,спам
"Не у яему придраться даде при всем желании,  но такого желания",спам
"Ну тут без изменений. меня шатает та скорость и стоимость. да поездка на такси дороже и дольше,чем это чудо",спам
олапиттлдб нд сн оо супер,спам
Она та. Ала. А стал . адвдадтв,спам
очень хорошо спасибо большое за поздравления и за поздравления и за поздравления и вас с новым годом желаю вам здоровья счастья и всего,спам
Содотаожажовгшк с до Анна Шагала,спам
Спасти по ввлутытытвгвгвггг,спам
Щомшнаеигиоио Гир гр Гриша да да да да не,спам
The only way I could do that was if you had to do,спам
Аовладдадададададвдвдалалалалала дададаладулу далалала,спам
Во-во аовлу утвлв вовдц вицоцдту уоулц втулуье даьк улулу а водудукд у ут,спам
Ну и как как у у вас вас там там как как у у так так вот вот это это да да я я не не,спам
Оови вла в лв влв в  втвтвттваьа ладьв,спам
респект сигма момент плюс вайб ты сделал мой день урыв этого кринжика 52 тебе от всех наших,спам
Ют жовдрчдрвдрчщрчжосжрчдичдрчщрчдрс,спам
Jdjsjjd hahahaha shsnnsjxndjd,спам
The only reason I would want to be in the same situation as you was that I’m going,спам
в асасин криде три когда убиваешь животное есть ощвучка няма,спам
Угоуоарвшвбвтововтв Ала е п п. Па а а. А а влдвшалоп,спам
класс а я уже в школу пошла а что у меня там есть что ли или нет,спам
О тот о то толошлдж лллмп лол лд,спам
ах до по до по до по до по до по ГП по ГП по р по,спам
