текст,категория
"прошло 2,40 минут от момента заказа до того как привезли заказ, хотя обещали максимум 1час 40 минут. ужасная фирма и  доставка, приборы не положили((",не спам
Все вкусно! Но почему то на 300 руб оказалось дороже чем обычно. Видимо из за приложения. Так как набор через группу в ВК дешевле,не спам
не полностью привезли заказ,не спам
"не положили 2 соевых соуса,в заказе 3 шт,а привезли 1",не спам
"не положили имбирь,роллы не очень на вид,пятница все устали 😁",не спам
"Не положили соус, имбирь и палочки, в чеке все оплачено",не спам
"везли два часа, привезли всё холодное, естественно отказ.",не спам
"Не привезли, не перезвонили, что не привезут.  2 часа сидел ждал, оказалось не работают судя по всему. Почему тогда можно заказ сделать?",не спам
"вместо лосося в роллах крабовая палочка, в целом по вкусу неплохо, очень долгая доставка (ждали 2 часа)",не спам
за баллы привезли домашнюю булку,не спам
"Ресторан доставил с большим опозданием еду, и еда конечно же была холодной. Повара видимо очень старались, что положили нам в подарок в блюда два коротких, черных волоса. Блюда мы выбросили. Осталась пицца, безумно жирная, что свернётся поджелудочная. Очень пожалели, что заказали в этом месте, и очень пожалели , что так долго ждали третьесортную еду(((",не спам
"заказали сет роллов и взяли за баллы пиццу КУРИННУЮ с грибами , нам привезли пиццу с колбасой ДОКТОРСКОЙ  , и больше в пицце ничего нету 
человек не переносит колбасу 
позвонили с возмущением , почему так 
на что девушка отвечает у нас теперь во всех пиццах вместо курицы идет колбаса , решить проблему эту она никак не хотела , говорит мол доволствуйтесь за бесплатно что дают , якобы раз блюдо бесплатное то они сами выбирают что вам положить 
Хотя когда уточняли заказ , она сказала у вас сет такой то , и пицца куриная!
Отвратительно , сюда больше не ногой ! крайне не рекомендую эту ЗАБЕГАЛОВКУ КОЛБАСНУЮ !
(Причем колбаса самая дешевая , красная цена)",не спам
"Я очень люблю кушать в Холмс, но, когда ждешь доставку больше 2 часов, а по итогу получаешь холодные блюда, отсыревшую напрочь картошку, становится очень грустно…в этот раз сервис мягко говоря разочаровал.",не спам
"Отврат, ждали доставку больше двух часов, хотя в приложении примерная доставка указана в 60 минут. После такого дерьма никакой пиццы уже не хочется, спасибо
Курьер приехал через 2,5 часа, привез резиновую холодную пиццу и непонятные кольца кальмара размокшие, есть не стали",не спам
к сожалению привезли 1 суши вместо заказанных 2х(( печаль,не спам
"не положили соевый соус к сушам, приборы не положилили и суши как будто в холодильнике лежали больше суток",не спам
"Все хорошо, кроме того что доставка задержалась, и внутри почему то находились насекомые",не спам
"Доставка оказалась больше 2 часов, еле связались с рестораном (ответили только когда связались с оператором чибиса и начали обсуждать отказ) все остывшее , пакет от шаурмы мокрый, в ролах единственное, что не пожалели это рис, васаби капля, имбирь сухой пара слайсов, в Угре огромные кости.",не спам
"Обещали привезти заказ за 1.5-2 ч, а привезли за 3 часа. Обещали вернуть 10% с заказа, не вернули. Пицца деревянная, суши разваливаются. Настроение 👇🏼",не спам
"Заказ доставляли более 2 часов!!! Естественно, пришло все холодное (в основном заказывали запеченные) и невкусное. 
Курьер, на вопрос «горячее?» ответил «конечно». 😬",не спам
"Оформила заказ в «Мясорубка», сумма к оплате 1440, написано, что доставка бесплатно от 800 рублей. Тем не менее, за доставку с меня взяли 200 рублей, так еще и доставили до подъезда, хотя я указывала и этаж и квартиру. Мне пришлось спускаться с 5 этажа, забирать заказ. Не был бы оплачен, отказалась бы. Отвратительный сервис!",не спам
"Всё не первой свежести. Готовили не сейчас, всё пресное, сухое, доставка с задержкой. будем прощаться",не спам
"шашлык пережарен, кроя подгоревшие, между слоями недостаточно лука. Грибы и картофель-норм. При заказе был подтвержден Армянский хаш, за 0 р, который был потом был исключен ( нет в наличии), считаю это обманом. Нет продукта, не выставляй!",не спам
Роллы за бонус привезли не те которые заказал,не спам
"курьер,не привёз заказ 3 часа ждали ужас 😰 (",не спам
"Мисо суп отличается от заявленного,тофу вообще не было. Суши маленькие а цена большая.",не спам
"В это раз не повезло. Доставка должна была быть в 19:00, в итоге привезли только к 20:30. И то, после того, как пришлось связываться с поддержкой. Приборы, соус/имбирь/васаби  не доложили. Ко вкусу претензий нет. Но…сет за баллы тоже не положили. Не приятный осадочек остался.",не спам
"Вообще не доставили заказ, служба доставки вообще не знает где заказ . Не отвечал и мне ресторан не отвечали 
К мероприятию заказывала и хер, спасибо бл… огромные !!",не спам
доставка три часа это перебор.наврятле еще закажу,не спам
По чеку курьер взял на 120 р больше чем стоимость в приложении. А сами суши вкусные,не спам
"Заказ едет более 2 часов. Я понимаю, что пятница, но время доставки было увеличено с 1ч до 2ч. Прошло уже 2,5 ч
Заказала еще нет.",не спам
"Гункан один не доложили, пирог или ролетту (не помню как) сожгли, везли заказ больше двух часов, но об этом хотя бы предупредили. А вот за качество и неполное количество еды конечно дизлайк",не спам
"привезли с опозданием вообще не наш заказ, ни одна позиция не соответствует заказу",не спам
"Заказа не было ,никто не отвечал на звонки.",не спам
"все холодное, привезено на полтора часа позже и про приборы забыли",не спам
"Доставка быстрая 
В подарочном ролле,по описанию должно быть авокадо, по факту огурец.Сливочный соус по факту просто водичка, консистенции соуса нет. ролл не понравился, пицца вкусная",не спам
"Часто заказываю из этого места еда вкусная НО постоянная проблема топпинги которые я заказал и оплатил они кладут через раз, а вот деньги за них берут постоянно. На звонки не отвечают когда звонишь им узнать почему в этот раз ОПЯТЬ не положили",не спам
"Второй раз я заказываю у вас в надежде нормально поесть, но неудачно. Сегодня я заказал заказ в 5:19, привезли мне его в 7:05, хотя заявлено 60-70 минут. Далее уж не стал отказываться, как в прошлый раз, так как еще ждать уже не было времени. Открыл. Все максимальное холодное, я в шоке просто, как и за счет кого эта компания до сих пор существует, потому что это происходит уже не в первый раз. Так они еще и за доставку берут 100. Короче, ну все. Это перебор уже. Я не знаю, правда, как можно так относится к своим клиентам.",не спам
"Первый раз заказывали здесь суши. И последний. Везли долго. Опоздав уже на 20 мин, сообщили, что курьер будет с минуты на минуту. Приехал он уже с остывшей едой минут через 40. 

Сами суши навалены плотно. Хорошо покатались, были изрядно помяты. За кучей соусов не ощущается вкуса рыбы. Или её настолько мало. 

Для людей, которые ценят вкус еды и сервис - рекомендую поискать альтернативные доставки. Цене не соответствует качеству",не спам
"Доставку привезли спустя более 2 часов и трёх напоминаний от службы поддержки. 

То, что должно было быть горячим - холодное, салфеток нет совсем, зато куча палочек, которые просили не класть. 

Было пожелание оставить заказ у двери квартиры, но курьер оставил на общей площадке, на лестнице. До квартиры не донес. Хорошо, что курьер позвонил в домофон и мы сразу вышли за заказом.

На звонки ресторан не отвечал. Судя по статусу заказа, его ещё везут.

Первый раз такое.",не спам
"очень долгая доставка, больше 2 часов. Если бы раньше прочитала отзывы, не заказала. - НАДО ПЕРЕВЕСТИ В ДОСТАВЛЕН?",не спам
"роллы слишком солёные, вместо фруктовых роллов принесли луковые кольца",не спам
"Привезли вообще не те роллы в сете ,одна порция точно не та.роллы до конца неразрезанны,ну и по вкусу не очень .",не спам
"В заказе должны были быть крылышки в панировке, но мы их не обнаружили. Роллы, честно говоря, не вкусные. ‘Пивная тарелка’ шла в подарок, но по факту за уплаченные деньги как будто бы и не было никакого подарка)) 
все лежало не аккуратно, в общем осталось плохое впечатление.",не спам
"приехала еда не соответствующая фото,которое представлено у ресторана на сайте. заказывала к 18,00 если бы приехали +-5 мин все понятно было ,но не на 20 мин. палочки не положили хотя были указаны столовые приборы 
отрицательные впечатления
дополняю после как начали есть это чудо, одна креветка попалась не отчищеная 
на другом ролле тока взят который с упаковки снизу ролла волос 
спасибо",не спам
"Картошка была вкусной. Фалафель так и не привезли, к сожалению.",не спам
"Заказ доставляли 2 часа ! . Вся шаурма мокрая , курица имела не приятный запах . Отвратительно",не спам
"Заказ не был доставлен, не понятно почему стоит статус ято доставлено. Ждали ждали, и не дождались.
Именно за данный заказ минус.  А так роллы вкусные, всегда заказываем.",не спам
"первый раз пишу вам отрицательный отзыв, пиццу перепутали, привезли другую, а она с луком с приправами, ребенок есть отказался, муж тоже. Роллы развалились как каша, пришлось есть ложкой, вкусно конечно, но как то не то",не спам
"очень долгая доставка. Привезли тогда,когда уже и не нужен был этот заказ. отменить не успела. мало того,что у заведения заявлен долгий срок доставки (90 минут), так ещё задержали на полтора часа",не спам
не доставлено нечего оценивать,не спам
приехали не весь заказ. на 24 суши один соус.  сет из 3х суш оказался в наличии только 2,не спам
"Заказ сделан в 15:34, доставлен лишь в 18 часов, курьер позвонил лишь в 17:36. Еда не вкусная, пицца ужас, горелая и сыр совсем не кажется что там 4 сыра, роллы слеплены так что разваливаются. Больше там заказывать не буду.",не спам
"К сожалению, в заказе с сетом перепутали два вида роллов (положили абсолютно не те, что были заявлены) 
Во вкусе некоторых роллов чувствовался вкус совершенно других, видимо, иные роллы хранились или лежали с другими во время готовки.
Насчет заказа со мной так и не связались.

Думаю, что в следующий раз закажу в другом месте.",не спам
"не положили пиццу забаллы
даже в чеке она не указана, а баллы списали",не спам
"Всё было ужасно от несоответствия цен в вашем приложении и в чеке, до качества и доставки. Разваливающиеся роллы, хотелось бы ещё и фото приложить, нори пожелели, так что на ролл не хватило! Одним словом кошмар, больше никогда не будем заказывать в этой конторе суши🤬",не спам
"Еда пришла отвратительного качества. Все воняло протухшим. Лапшу в удоне нельзя назвать лапшой, переварена и вся в кашу превратилась, креветок вообще нет, овощей мало. В ресторан не дозвониться чтобы отменить или узнать про заказ. Ждали этот заказ больше 4 часов",не спам
"доставка 1.5 часа, даже чуть дольше, а рис сырой, явно недоваренный, сильно чувствовалось. как так?",не спам
"В составе салата указан тунец, но не положили ни единого кусочка, специально искала. У так называемого супа неприятный запах, видимо, просто вылили туда самого дешёвого консервированного лосося, вкупе с парой тонюсеньких шампиньонов.",не спам
пиццу не доставили.остальное все есть,не спам
"это тихий ужас! всё ролы кривые, вместо гункана привезли суши с угрём, вместо васаби- пластилин, имбирь скисший, шапочки на ролах сырые. крайне не рекомендую.",не спам
"роллов за баллы было всего 16 , а не 24 как заявлено 😡и приборов вообще не положили 😡😡😡😡",не спам
"Отсутствовали приборы, которые оплачены",не спам
"Всегда пользовались доставкой данного ресторана , но сегодня это треш!!! 
Вместо того чтобы привезти заказ вовремя , привезли спустя 3 часа!!! 
Начнем с прекрасного что это был предзаказ на определенное время именно на 8 часов , в итоге заказ привезли в 22:00 , весь заказ холодный , шаурма уже вся холодная , начала разваливаться , мокрая сколько часов она ехала неизвестно 
В приложении чибис поставили что заказ доставлен , но по итогу привезли в 22:00
Администратор который отвечал на звонок такое чувство будто пьяный, 8 раз надо повторять информацию потому что человек не понимал ее просто .  Сказал что следующий заказ будет со скидкой 10%, кому нужна скидка , если вы доставляете еду 3 часа, по предзаказу на определенное время. И постоянно говорил человеку что не понимает что ему говорят. 
Сегодня вы просто переплюнули все ужасные места нашего города. Спасибо за испорченный вечер",не спам
"больше двух часов ждали курьера, но он быстро поднимался по лестнице, еда вкусная, но расстроились 😓",не спам
"Заказывали доставку в данном заведение через чибис, после 50 минут, пришлось звонить самой и спрашивать, приняли они наш заказ или нет, на что девушка мне ответила что им не когда было мне перезвонить, и сказала что в наш район (хотя каштак относиться к центральному району) доставка будет стоить 240 рублей, а на сайте написано что от 1500 доставка бесплатная, китайская кухня просто отвратительная, единственное на удивление были вкусные бонусные роллы.",не спам
Половину соусов не положили вообще. Больше заказывать в этом ресторане не будем. Дизлайк,не спам
"Доставка была медленнее, чем черепаха переходящая улицу, в следствие чего еда ледяная. От оператора доставки были лишь постоянные отговорки - изначально время доставки было оговорено 1:20, позже стало 1:30, в итоге заказ привезли через два часа, ссылаясь на большую загруженность кухни. Упаковка мятая и побитая. Так же роллы вообще не похожи на то что представлено или хотя бы описано. Заказ грубо говоря на 2 балла из 5.",не спам
"забыли положить спайси соус хотя оплачен был, а так все хорошо",не спам
к сожалею забыли положить соевый соус и имбирь😔,не спам
Не доложили два соуса в пати бокс!,не спам
не положили морс в заказ :(,не спам
не положили чизкейк за баллы,не спам
"заказывал 2 шаурмы и сырные палочки, мало того что доставку ждал более 2х часов, заказ привезли предельно остывший, шаурма разваливалась, лаваш жёсткий, соуса там будто просто капнули, овощи далеко не первой свежести,помидоры очень горькие, мясо оставляет желать лучшего, заказывал сырную и острую, в сырной просто 2 сырных палочки, которые просто отвратительные, сырные палочки очень солёные и просто напросто сухие. Всё выбросил. В целом если у них не заказывать, то пойдёт. Не рекомендую!!!",не спам
Почему в чибисе платная доставка....отвратительно обманывать своих клиентов,не спам
"Еда ко мне не пришла, о каком заказе идет речь",не спам
Ждали заказ 2 часа. Жуть.,не спам
"Роллы вкусные, но опоздали на 58 минут! Заказ был оплачен онлайн, а так бы отказались. Пожалуй, по пятницам в этой компании заказывать не стоит. Диспетчер на наши звонки и вопросы по заказу ничего внятного сказать не могла, только что заказ у курьера. А курьер, видимо, шел пешком. Устало передал нам заказ и ушел.",не спам
