текст,категория
"Греческий салат за бонусы откровенно несвежий и невкусный, лук в нём и остальные овощи выглядели пожухлыми. Есть не смогли, выкинули. Пицца вкусная, но начинка была расположена неравномерно: в одной половине пиццы - много, в другой-местами. Доставка опоздала на пол-часа.",не спам
заказ привезли другой и не предупредили об этом ужас полный,не спам
"К суши не предусмотрены соевый соус, васаби и имбирь? Не были доставлены.",не спам
"В заказе добавлен васаби, в чеке написан имбирь, по итогу положили вообще соевый соус. Где васаби? Очень хотелось с ним поесть роллы",не спам
"Сделал заказ на 4 вида мяса, привезли 3, т.к. перепутали заказы. Сказали, пугайте, что привезли.",не спам
"заказ привезли через 2 часа, от заявленных 40 минут, никто не перезвонил уточнить заказ, и даже когда нажимал на кнопку, чтоб мне перезвонили. а так более менее вкусно",не спам
вместо фри положили картофель по-деревнески,не спам
"Количество в описании и на фото, не соответствует тому что привезли",не спам
"Не положили соус на роллы, без соуса вообще не вкусные",не спам
Вместо имбиря положили соевый соус. Хотя по телефону все проговаривали.,не спам
"Хочется отметить красивую упаковку и то что все свежее, привезли быстро. Риса много и майонезов разноцветных много, начинки мало. На вкус средне, в комплектации нет палочек, соуса, и тп., отдельно платно, благо есть все дома это. По итогу впечатление среднее ближе к никакому, больше заказывать не буду. Хотя повторюсь что все свежее, но не вкусно",не спам
"Заказ отменён,баллы не вернули,а написано что заказ доставлен!!!",не спам
"Не вкусно вообще, сашими ни о чём, цезарь заказала с креветками привезли с курицей, так мало того он вообще безвкусный",не спам
"не привезли заказ, не брали трупку",не спам
"заказ был сделан в 01:30. заведение работает до 2:00 . После заказа никакого звонка не поступало даже когда я просил перезвонить,никто не перезванивал. Внимание вопрос .Зачем вы работаете до 2:00 если заказы не принимаете и даже их не привозите ? 0 звезд ,ждите еще 20 отзывов с 1 звездой",не спам
"Заказ ждали два часа, вместо обещанных 1,5. Палочки не положили, хотя в заказ их включили!!!! Рис разваливается, не возможно даже взять! Не советую брать. Отношение отвратительное и разговаривают как с подружкой!",не спам
"Хлеб был не тот что в заказе, не были подписаны сабы",не спам
"Не положили имбирь и васаби... это как?
курьер забыла терминал...
но роллы вкусные )",не спам
"Стало не вкусно, порции меньше.
Если на доставку дак х7&amp;ню можно сделать ? Не положили имбирь, 1000 и 1 оправдание. Чизкейк бумажный, это вот как? 
Очень разочарованы, вечер был испорчен.",не спам
"Вкус роллов уже не такой, как раньше и они были остывшие( не положили ничего, кроме салфеток (ни соевый, ни васаби, ни имбирь)",не спам
"не доставили заказ ,ждал заказ 5 часов",не спам
"Начнем с доставки, ролы ехали в лесик около 2,5 часов, вкус у ролов как у переваренного риса, не более. На две персоны было выделено 1 имбирь и 1 соевый, всё в маленьких ёмкостях. На 60 роллов это очень мало. Некоторые роллы очень маленькие. Как такового вкуса у роллов нет, очень пресные. С соевым - нормально, но как уже и писала выше - его очень мало. Раньше заказывали в ролике и всё было вкусно, быстро - сейчас очень разочаровали",не спам
"Соевый соус и васаби в стоимость входили ,я даже в поддержку писала спрашивала!
Мне сказали что входит в стоимость.
Но их не было",не спам
"жду 3 с половиной часа, интересно сколько еще останется. спасибо",не спам
"Сет не соответствует описанию! Во всех роллах внутри находится кусочек огурчика и все, ни угря, ни семги, ни мидии, ни курицы нет!!! Просто шапки разного вкуса",не спам
"за баллы заказывала картофель гриль, но отдельного блюда с ним не было, и я не поняла - картошку добавили к шашлыку или всё-таки вообще не положили??",не спам
забыли положить палочки и один соевый соус. но в целом роллы были вкусные,не спам
Не положили соус в очередной раз,не спам
"пицца вообще не соответствует фото. Доставили просто  лепешку с бортиками. как будто начинку забыли положить 🙄. и ее размеры всего 26-27 см, а не 30. в общем, больше здесь не будем заказывать...",не спам
"привезли с опозданием,пицца холодная была,обещали купон на бесплатную пиццу  за задержку,его не было...",не спам
"самый худший том-ям, за 450 р. 300 грамм. морепродукты-их не было там вообще, даже не одной креветки. пицца пересушенна. крылышки в панировке на 3.",не спам
Не привезли одно блюдо а на вкус неплохо. но дорого,не спам
"Шашлык куриный сильно пересоленный. Морс вообще нам не положили, хотя мы за него заплатили сразу по карте. В шаурме за баллы мяса вообще не было, одни прожилки. Заказывали здесь первый и последний раз.",не спам
"Заказ не был доставлен, а деньги списали! Пыталась отказаться, но не смогла.",не спам
"доставка оказалась дольше обещанного минут на 40. Понятно, что суббота, но рассчитывать как то нужно. Роллы не очень вкусные. темпура и пицца холодные приехали.",не спам
"прислали не те суши что на фото, совсем не те",не спам
"Отвратительно, ждали 3 часа, пицца 23 см вместо 33. Вся еда пресная и безвкусная. Ужасно",не спам
все замечательно кроме доставки(почти 3 часа с момента заказа),не спам
"Ужасный сервис! Приборы не положили, еда холодная",не спам
"Заказ шел 3 с половиной часа, ошиблись адресом, еда по итогу холодная, извинения в виде 3 кусков пиццы конечно очень смешное( просто извинений бы хватило и все ) , вид еды желал оставлять лучшего, первый раз решил попробовать заказать у данного заведения, больше не закажу, посоветовать конечно же данное заведение я не могу! оценка 3/10, старайтесь лучше, надеюсь вы обязательно исправитесь и найдете курьеров для развозки еды!",не спам
"В заказе был фирменный сет и нежный тай в подарок. Но по какой причине в заказа оказалось два нежных тая не понятно, когда фирменный сет не должен содержать ролл нежный тай. Очень обидно что люди так работают.",не спам
"Служба доставки просто ужас! Доставили только суши без приборов и соевого соуса! Сидели ждали когда довезут, 1,5 часа!!!!!! Суши остыли, а это был день рождения! Просто испортили праздник!(день рождения) Больше никогда здесь не закажу.",не спам
"Привезли не те ролы, вместо Филадельфии какие то запеченые😡😡😡",не спам
"доставка более 2х часов, отсутствует термобокс, роллы кривые, мятые,холодные, такое ощущение что курьер шёл к нам пешком и пенал пакет перед собой",не спам
"администратор не перезванивала, и в ресторан было вообще не дозвониться, спустя 3 часа нам только перезвонили, сказали что курьер уже выезжает и все, в итоге он задержался почти на час, в заместо 23.30 заказ получили в 00.20, все время время ожидания сидели на иголках, не известно заказ принят и доедет ли вообще, при условии что деньги заплатила онлайн",не спам
"не положили соус, хотя я его заказывала",не спам
Положили не все блюда из заказа,не спам
"Заказ доставляли больше 4х часов, звонили в ресторан больше 10ти раз никто не взял трубку. Единственное, сам курьер принес извинения. В самой пицце только тесто вкусное, начинка никакая, так ещё и сверху как будто весь пакетик приправы фиганули, ели остывшее тесто с паприкой. Заказом разочарованы.",не спам
"Заказывали сет и пончик за баллы. Доставка опоздала, но это не критично) хотя раньше даже всегда раньше времени привозили. В итоге привезли сет и всё) не имбиря, не соуса, не васаби не было) связалась с оператором, сказали имбирь и тому подобное теперь за отдельную плату, а пончик довезут позже. Я попросила с пончиком довезти и имбирь, в надежде, что привезут в течении получаса. По итогу привезли через час) 
В общем не приятненько было, думаю теперь не скоро сделаю заказ)",не спам
еда не пришла ждали три с половиной часа не дождались ужас,не спам
"Ждали 2 часа подтверждения, нам позвонили и сказали еще 2 часа ждать, после чего мы отказались от заказа. Почему-то поставили статус «доставлен» и деньги списали. В общем, голодные и злые были, вечер был испорчен.",не спам
"Ужасно, везли три часа вместо обещанных 1:30. все холодное, не вкусное. В помойку",не спам
"в статусе заказа написано, что заказ доставлен, но по факту никого не было.",не спам
картофель пересолен. котлета сухая. ну а пиццу вместо баварской привезли с грибами и ветчиной. Просто молодцы! слов нет!,не спам
заказали 1 средний и 1 большой бургер. пришли по размеру как будто 2 средних. по размеру вообще не отличались друг-от-друга. только один был чуть тяжелее,не спам
"Не я конечно всё понимаю, я живу очень далеко и то что заказ холодный оправдать можно. Но то что его готовили два часа , а курьер ехал часа полтора..ну такое если честно.
Пиццу вроде бы заказывала 4сыра , читала наполнение чтобы была только сырная , приехала с помидорами, грибами и ветчиной, дорогие мои , это называется 4сезона тогда , а не 4сыра 😀
По вкусу очень соленая и из самых дешевых продуктов, хотя за их цену могли бы и по лучше по стараться. Цезарь съедобный, но не прям вау , проще было самой сделать, но к сожалению магазины закрыты, Луковые кольца более менее , но тоже такое смотря на них пробовать не очень хотелось. Даже кот есть не стал , очень жаль конечно что деньги на ветер продукты в мусор.Искренне не советую!!!",не спам
Где заказ????? Вы издеваетесь чтоли?,не спам
"Рамен не довезли. Ганкан с креветкой ужасный. Суши с тунцом отвратительный, тунец перемороженный, рис жесткий",не спам
"Заказали четыре порции Цезаря, оказалось, что это четыре порции китайской капусты, с небольшими дольками помидора, двумя кусочками курицы переперчённых, а гренки не всем и попались!!!! возмущению нет предела, ведь стоимость этого так сказать салата Цезаря приличная. Пиццу привезли холодную. Ужин испорчен!!!!!! и почему-то оплата не через терминал.",не спам
Не положили оплаченные палочки. Бургер сухой. Роллы какие-то без вкуса,не спам
ждали 3 часа отказывались от заказа потому что уехали,не спам
"Как многие пишут, в заказ не положили колу. Если перестали класть колу, отредактируйте позицию блюда. Если входит кола как указано , систематически забывать её и потом говорить ""ой чё то забыли"" прямо говорит об отношении заведения к своим клиентам. 
 Моя личная рекомендация, не заказывайте ничего у них. Вы кладете болт на клиентов - клиенты кладут болт на вас.",не спам
"доставка очень долгая так еще и сильно опоздали по итогу мясо еле теплое, картошка и фри уже холодные, хотели быстро перекусить и пойти по делам, но нет, нас даже никто не предупредил что курьер опаздывает, пришлось с поддержкой разбираться",не спам
"через час после оформления заказа только позвонили, и сообщили что доставка будет через 1-1.15. общее время доставки в итоге составили 2.5 часа. к еде претензий нет, все вкусно.",не спам
не полностью доставлен заказ.,не спам
"Доставка почти три часа,обещали в течении двух часов!!!Блюда все холодные,пицца-одно тесто почти,больше не закажем доставку там!",не спам
"Доставка почти четыре часа заняла, не знаю даже, буду ли снова здесь заказывать…",не спам
привезли спустя 2.5 часа еще и совсем другие роллы,не спам
"Заказали в 15:40 2 салата и пиццу за баллы, время доставки было указано 17:18. В 17:30 привезли только пиццу, на вопрос о салатах курьер сказал что не собирает заказы и уехал. Самостоятельно связался с диспетчером, на что мне ответили, что салаты готовы и курьер не забрал, сейчас довезут. Прошел ещё час, салатов нет до сих пор, деспетчеры отвечают что курьер уехал. Итого 3 часа ожидания своего блюда. Вопрос: если Вы совершили ошибку и все сроки доставки давно прошли, неужели нельзя отнестись по-человечески и отправить курьера специально довезти часть заказа, а не ждать формирования следующей доставки? Мы уже давно пообедали и есть салат, который 3 часа лежит готовый в контейнере нет никакого желания. Никогда больше не посоветуем и сами не будем здесь заказывать",не спам
"Сам курьер, который доставлял заказ кросава. В целом ресторан неплохой, все вкусно. Но к сожалению, дичайший про** с адресом доставки. Неправильно зафиксировали адресс, из-за чего заказ пришлось ждать прям рииально долго. Но о5 таки подчеркну, что сама еда на уровне. Но такие моменты расстраивают (",не спам
"Ехал 3 часа, у,пели заказать у других.
Не рекомендую заказывать еду к галуште.",не спам
"ужасная доставка, жду заказ уже на протяжении двух с половиной часов , и до сих пор нет",не спам
"роллы привезли позже на 20 минут. Не критично, но роллы были все холодные",не спам
"Во первых ждали наш заказ 3 часа. Во вторых, роллы сухие, рис невкусный, рыбы очень мало….. одна темпера и рис. Что касается васаби, то это не он. А просто покрашенная горчица… соевый соус абсолютно несоленный, сильно разбавленный. насчет пиццы своих денег она не стоит. Начинки очень мало. Теста много, бортики не пропеченые. В городе есть места где намного вкуснее и дешевле. Пожалели что захотели испробовать блюда из данного заведения….",не спам
"в пиццу положили лук, хотя я писала коментарий чтобы было без лука, ещё и по телефону говорила",не спам
"Сделали заказ картой курьеру без перезвона, к назначенному времени никто не явился, чиббису ресторан не ответил, никто ситуацию никак решать не стал. просто так оставили в ночи людей голодными, супер сервис.",не спам
"Что касается самой еды - претензий нет, роллы как роллы. Но доставка вызвала скорее негатив. ожидание составило 2.5 часа, вместо обещанных 1.40. и на протяжении всего ожидания, в приложении стоял статус ""в обработке"". По комплектации - специально уточняли сколько приборов класть-в итоге, положили меньше, чем просили. Специально оставили комментарий, чтобы курьер не звонил в домофон, так как спит ребенок - комментарий не передали курьеру.",не спам
"Сделали заказ сета и сырных палочек. В приложении показывало доставку 60 минут. После принятия заказа в работу , показывало время ожидания в 2,5 часа. Связались с каким-то непонятным человеком который сказал, что привезут примерно через час/полтора. В итоге заказ приехал спустя 2,5 часа. Сет отвратительный, роллы развалившиеся. Половина роллов - это рис и капуста нори. Попался 2 раза пластик. В сете 1 вид роллов, когда указано 3. Комплектация: 2 соуса , 1 имбирь (кислый), 1 васаби и 3 комплекта палочек, нет салфеток.
Никому не рекомендуем тут ничего заказывать!",не спам
"Не положили палочки, соевый соус и васаби. Плюс сами роллы очень солёные. Звоню в течении получаса и никто не берет трубку!!! Я была о вашей фирме лучшего мнения!!!",не спам
"Заказ сделан в 18.3
Время в данный момент : 00:46 заказ в обработке 👍🏻👍🏻👍🏻",не спам
"доставку ждали 2 часа. Нагетсы были все горелые и мяса в них миллиметр,соус безвкусный, как будто водой разводили. Одно разочарование !",не спам
